[
  {
    "contract_id": "CDLZFC3SYJYDZT7K67VZ75HPJVIEUVNIXF47ZG2FB2RMQQVU2HHGCYSC",
    "topics": ["transfer"],
    "event_structure": {
      "topics": [
        { "name": "from", "type": "address" },
        { "name": "to", "type": "address" }
      ],
      "data": { "name": "amount", "type": "i128" }
    },
    "english_template": "Public Key [{from.short}] transferred {amount.formatted} USDC to [{to.short}]"
  },
  {
    "contract_id": "CBIELTK6YBZJU5UP2WWQEUCYKLPU6AUNZ2BQ4WWFEIE3USCIHMXQDAMA",
    "topics": ["transfer"],
    "event_structure": {
      "topics": [
        { "name": "from", "type": "address" },
        { "name": "to", "type": "address" }
      ],
      "data": { "name": "amount", "type": "i128" }
    },
    "english_template": "Public Key [{from.short}] transferred {amount.formatted} XLM to [{to.short}]"
  },
  {
    "contract_id": "CAZAQB3D7KSLSNOSQKYD2V4JP5V2Y3B4RDJZRLBFCCIXDCTE3WHSY3UE",
    "topics": ["transfer"],
    "event_structure": {
      "topics": [
        { "name": "from", "type": "address" },
        { "name": "to", "type": "address" }
      ],
      "data": { "name": "amount", "type": "i128" }
    },
    "english_template": "Public Key [{from.short}] transferred {amount.formatted} EURC to [{to.short}]"
  },
  {
    "contract_id": "CAAAAAAAAAAAAAAAAAAAAAAAAAAAAAAAAAAAAAAAAAAAAAAAAAAAD2KM",
    "topics": ["transfer", "mint", "burn"],
    "event_structure": {
      "topics": [
        { "name": "from", "type": "address" },
        { "name": "to", "type": "address" }
      ],
      "data": { "name": "amount", "type": "i128" }
    },
    "english_template": "Public Key [{from.short}] transferred {amount.formatted} USDC to [{to.short}]"
  },
  {
    "contract_id": "CBBBBBBBBBBBBBBBBBBBBBBBBBBBBBBBBBBBBBBBBBBBBBBBBBBBBBBBBB",
    "topics": ["transfer", "mint", "burn"],
    "event_structure": {
      "topics": [
        { "name": "from", "type": "address" },
        { "name": "to", "type": "address" }
      ],
      "data": { "name": "amount", "type": "i128" }
    },
    "english_template": "Public Key [{from.short}] transferred {amount.formatted} XLM to [{to.short}]"
  },
  {
    "contract_id": "CDLZFC3SYJYDZT7K67VZ75HPJVIEUVNIXF47ZG2FB2RMQQVU2HHGCYSC",
    "topics": ["mint"],
    "event_structure": {
      "topics": [
        { "name": "admin", "type": "address" },
        { "name": "to", "type": "address" }
      ],
      "data": { "name": "amount", "type": "i128" }
    },
    "english_template": "Admin [{admin.short}] minted {amount.formatted} USDC to [{to.short}]"
  },
  {
    "contract_id": "CBIELTK6YBZJU5UP2WWQEUCYKLPU6AUNZ2BQ4WWFEIE3USCIHMXQDAMA",
    "topics": ["mint"],
    "event_structure": {
      "topics": [
        { "name": "admin", "type": "address" },
        { "name": "to", "type": "address" }
      ],
      "data": { "name": "amount", "type": "i128" }
    },
    "english_template": "Admin [{admin.short}] minted {amount.formatted} XLM to [{to.short}]"
  },
  {
    "contract_id": "CAAAAAAAAAAAAAAAAAAAAAAAAAAAAAAAAAAAAAAAAAAAAAAAAAAAD2KM",
    "topics": ["mint"],
    "event_structure": {
      "topics": [
        { "name": "admin", "type": "address" },
        { "name": "to", "type": "address" }
      ],
      "data": { "name": "amount", "type": "i128" }
    },
    "english_template": "Admin [{admin.short}] minted {amount.formatted} USDC to [{to.short}]"
  },
  {
    "contract_id": "CBBBBBBBBBBBBBBBBBBBBBBBBBBBBBBBBBBBBBBBBBBBBBBBBBBBBBBBBB",
    "topics": ["mint"],
    "event_structure": {
      "topics": [
        { "name": "admin", "type": "address" },
        { "name": "to", "type": "address" }
      ],
      "data": { "name": "amount", "type": "i128" }
    },
    "english_template": "Admin [{admin.short}] minted {amount.formatted} XLM to [{to.short}]"
  },
  {
    "contract_id": "CDLZFC3SYJYDZT7K67VZ75HPJVIEUVNIXF47ZG2FB2RMQQVU2HHGCYSC",
    "topics": ["burn"],
    "event_structure": {
      "topics": [{ "name": "from", "type": "address" }],
      "data": { "name": "amount", "type": "i128" }
    },
    "english_template": "Public Key [{from.short}] burned {amount.formatted} USDC"
  },
  {
    "contract_id": "CBIELTK6YBZJU5UP2WWQEUCYKLPU6AUNZ2BQ4WWFEIE3USCIHMXQDAMA",
    "topics": ["burn"],
    "event_structure": {
      "topics": [{ "name": "from", "type": "address" }],
      "data": { "name": "amount", "type": "i128" }
    },
    "english_template": "Public Key [{from.short}] burned {amount.formatted} XLM"
  },
  {
    "contract_id": "CAAAAAAAAAAAAAAAAAAAAAAAAAAAAAAAAAAAAAAAAAAAAAAAAAAAD2KM",
    "topics": ["burn"],
    "event_structure": {
      "topics": [{ "name": "from", "type": "address" }],
      "data": { "name": "amount", "type": "i128" }
    },
    "english_template": "Public Key [{from.short}] burned {amount.formatted} USDC"
  },
  {
    "contract_id": "CBBBBBBBBBBBBBBBBBBBBBBBBBBBBBBBBBBBBBBBBBBBBBBBBBBBBBBBBB",
    "topics": ["burn"],
    "event_structure": {
      "topics": [{ "name": "from", "type": "address" }],
      "data": { "name": "amount", "type": "i128" }
    },
    "english_template": "Public Key [{from.short}] burned {amount.formatted} XLM"
  }
]
